소속사,그룹,연예인 이름,사건 날짜,사건 내용
HYBE,세븐틴,민규,2021-02-22,"2021년 2월 22일 새벽, 민규가 학교폭력 가해자라고 주장하는 글이 네이트판에 올라왔다. # 자신이 민규와 초/중학교 동창이라고 주장하는 폭로자 A는 중학교 1학년 하굣길에 민규를 포함한 일진 무리에게 삥을 뜯기고 언어폭력을 당했으며 상황을 지켜보던 민규가 자신의 얼굴에 콜라 뚜껑을 던졌다고 주장했다. 또 중학교 3학년때는 연습실에 갈 차비를 모아오게 했고 금액을 못 채워오니 크게 화를 냈다고 주장했다. 졸업 앨범 사진과 페이스북 에 올라온 민규의 학창시절 사진을 증거로 제시했고, ""해당 사건은 모두 진실이며, 공식 사과문이 나오지 않으면 한 번 더 추가 폭로를 하겠다. 그래도 인정하지 않거나 신상을 요구하면 글을 지우고 평생 혼자 원망하며 지낼 각오를 하겠다""라는 댓글을 남기고 글을 삭제했다. # 그러나 A가 증거로 제시한 페이스북의 민규 학창시절 사진은 전체공개로 여전히 남아있어 지금도 검색하면 누구나 찾을 수 있는 상태였다. 또한 처음에는 '다른 반이었다' 며 동창임을 암시했다가 뒤늦게 자신이 민규보다 후배임을 밝힌 A는 22일 밤에 추가 폭로글을 올리겠다고 예고하였으나 아직까지 등장하지 않고 있다. # 민규가 안양에서 유명했던 일진이었다며 올라온 폭로글 대부분이 삭제된 상황이다. 이에 대해 플레디스 엔터테인먼트 측은 본인 확인 결과 해당 주장은 사실무근이고 명백한 허위사실 이며, 민규는 중학교 2학년 때부터 연습생이었고 , 글쓴이가 올린 졸업 앨범과 민규의 졸업 앨범은 다르다는 입장을 밝혔다. 또한 ""도대체 누가, 어떠한 의도로 이런 주장을 하고 있는 것인지 이해가 되지 않는다""라고 말하며 답답함을 호소하였다. # 민규의 초/중학교 동창이라고 주장하는 이가 졸업 앨범을 인증하며 ""민규는 성격과 친화력이 좋아 친구가 많았고, 그 중 일진 무리들이 몇 명 있었던 것이다."" 라고 민규를 옹호했고, 민규의 모교인 부림중학교 는 선배가 후배의 돈을 뜯는 일이 생긴 후 학교에 경찰이 배치되어 모든 학폭이 싹다 근절되고 분위기가 좋았다. 누가 돈을 뺏겼다는 건 말도 안 된다."" 고 글을 올렸다. # 이 외에도 인증과 함께 민규를 옹호하는 글들이 이어졌고, # , # ! # 그 가운데 인스티즈 폭로자도 등장했다. 최초 폭로글이 삭제되고 더 이상 올라오고 있지 않는 상황, 그리고 옹호해주는 많은 동창생과 선,후배들 덕분에 민규는 거짓 폭로의 피해자 일 뿐이라는 여론이 점차 형성되고 있었다. 기사 # 그러던 중 2월 25일 10시 경, 부림중학교의 분위기가 좋아 학폭 같은 일은 없었다는 옹호글에 반박하는 새로운 글이 올라왔다. 삭제됨 민규와 같은 학교/학원에 다녔다고 주장하는 작성자 B는 민규의 논란과는 별개의 내용 으로, 부림중학교에 학폭이 없었다는 건 잘못된 사실이라며 졸업증명서, 폭행을 당해서 생긴 흉터, 정신과 기록까지 사진으로 게재하였다. 그리고 같은 날 11시 경에 B는 민규와 관련된 폭로글 을 추가로 올렸다. 관련 기사 이 글에는 민규가 B에게 ""니가 뭘 아는데"", ""나대지 좀 마"" 라는 식의 말들로 B의 의견을 묵살하고 기를 죽게 만들었으며, 성적인 농담을 일삼고 성희롱하는 친구들에 민규가 동조했다고 주장하는 내용이 실렸다. 증거로 디테일한 학원 구조와 함께 2019년 3월 정신과 기록을 첨부하면서, 글의 신빙성이 매우 높게 받아들여지는 상황이었다. 다음 날인 26일 새벽 3시 경 쭉빵카페 에 추가 폭로글이 올라왔다. 폭로글 캡쳐본(원글삭제) 관련 기사 민규가 일진 무리에 속해 있었고, 자폐가 있는 장애인 친구를 괴롭혔으며 성추행에 가담한 적이 있다는 내용이다. 2월 28일 소속사 플레디스 측은 기존 폭로글 중 장애 학우 학교폭력에 대해서는 '장애 학생의 어머니를 만나 사실이 아님을 확인 했으며 다른 학교폭력 사안에 대해서는 확인 중'이라는 공식 입장을 발표했다. [ 소속사 입장 전문 ] 안녕하세요. 플레디스 엔터테인먼트입니다. 최근 세븐틴의 멤버 민규의 학창시절과 관련하여 온라인 상에 게시된 주장에 대한 당사의 입장을 공지 드립니다. 먼저, 당사의 입장을 더 빨리 알려드리지 못한 점에 대해 죄송하다는 말씀을 드립니다. 이번 주장들이 게시된 이후 당사는 아티스트 본인에 대한 확인 및 필요한 부수적인 확인 절차를 진행하였습니다. 그 과정에서 게시된 내용과 아티스트에게 확인한 내용 간에 차이가 있는 것을 확인하였습니다. 현재 학교폭력과 관련하여 사회적으로 많은 사안들이 발생하고 있는 가운데, 당사는 이번 사안에 대한 명확한 확인이 우선되어야 한다고 판단하고 모든 사안에 대한 확인 절차를 진행하고 있습니다. 이 과정에서 입장을 밝히는 것이 늦어진 점 사과드립니다. 앞서 말씀드린 대로, 당사는 명확한 사실 확인을 위해 다양한 방식으로 당시 사건 당사자와 연락을 취해왔고, 현재도 연락을 진행 중이며, 아티스트의 동창생 등 여러 주변인들로부터 그 당시 정황에 대해 확인하였습니다. 현재까지 확인된 내용에 대해서 우선 설명을 드리면, 아티스트가 장애 학우를 괴롭혔다는 내용이 있었는데 이는 전혀 사실이 아닙니다. 아티스트 본인이 피해자로 적시된 분을 명확히 기억하고 있어 수소문 끝에 당사자의 어머님과 연락을 할 수 있었습니다. 확인 결과 피해자로 적시된 분은 아티스트와 오히려 잘 지낸 사이였던 것을 확인해 주셨습니다. 어머님께서 자제분을 학교에서 괴롭혔던 학생들의 이름을 기억하고 계셔서 이 부분을 바로 확인해 주실 수 있었습니다. 현재 당사자는 사회 생활을 잘 하고 있으며, 과거의 일이 본인의 동의 없이 원치 않는 방식으로 알려진 것에 대해 부담스러워하고 계십니다. 그럼에도 불구하고 아티스트를 위해 사실 관계를 확인해 주셨습니다. 당사는 나머지 사안들에 대해서도 적극적으로 확인 중에 있습니다. 다만 이 사안들을 온라인 상에 게시하신 분들이 누구인지 특정하기 어렵고, 일부 게시글의 내용을 보면 게시자가 연락을 원치 않는다는 입장을 피력하시어, 접촉에 어려움은 물론 신중함까지도 요구되는 상황입니다. 당사는 글을 올리신 분께서 대면을 원치 않으신다고 밝히신 입장을 존중하며, 동시에 원하신다면 언제라도 원하시는 방식으로 만나 사실을 확인하고 그에 따른 조치를 취할 것이라는 점을 밝힙니다. 당사는 사회적으로 문제가 되고 있는 학교폭력 이슈가 피해자의 관점에서 고려되어야 한다는 점에 대해 이견이 없습니다. 다만, 피해자의 관점과 더불어 명확한 사실 관계의 확인이 이뤄진 후 필요한 조치들이 취해져야 한다고 판단하였습니다. 지금 문제가 되고 있는 내용은 과거 아티스트의 초등학교 및 중학교 때 발생했던 일이기 때문에 사실 관계 확인을 통해 실제로 발생했던 일에 최대한 접근해 판단하는 것이 필요하다고 보고 있습니다. 아티스트 본인은 이번 사안이 발생한 것만으로도 팬분들께 불편함을 끼쳐 진심으로 죄송하다는 입장을 밝힌 후, 현재 스케줄 활동을 잠시 멈추고 사실 관계 확인에 대한 모든 조치를 회사에 일임하고 있습니다. 당사도 소속 아티스트 관련하여 불편함을 드린 점에 대해 머리숙여 사과의 말씀을 드립니다. 이번 공지 내용이 본 사안의 끝이 아니며 지속적으로 사실 관계 확인을 진행하고 그에 따른 조치를 취해 나가겠습니다. 다만, 이 과정이 간단하지 않아 시간이 걸릴 것이라는 점 역시 양해를 부탁 드립니다. 피해를 받았다고 말씀하신 분들을 만나 사실을 확인하고 그 분들의 마음이 치유될 수 있게 하는 것이 가장 중요합니다. 그와 더불어 사실 관계의 확인 없이 한 아티스트의 인생이 달려있는 문제를 가볍게 결정할 수 없는 점도 이해를 부탁드립니다. 물론, 사실 관계 확인 끝에 명백한 잘못이 확인되면 당사는 그에 따른 조치를 명확하게 할 것이라는 점을 약속드립니다. 다시 한 번 소속 아티스트와 관련된 사안으로 불편함을 드린 점에 대해 사과의 말씀을 드립니다. 더불어 민규는 이번 사안이 발생한 것만으로도 불편함을 끼쳐 현재 사실 관계가 전부 확인될 때까지 활동을 중단한 상태라고 한다. 기사 앞선 폭로자 B의 글에 반박하는 내용이 네이트판 에 실리면서 폭로자 간의 진실 게임으로 치닫게 되었다. 링크 자신이 같은 학원의 수강생이라고 밝힌 C는, B에게 피해망상이 있고 피해자 코스프레를 일삼는 등의 행동으로 다른 수강생들에게 따돌림을 당해왔다고 주장했다. C는 그런 B가 안쓰러워 다가갔다가 오히려 B를 괴롭힌 왕따 가해자 누명 을 쓰고 현재까지도 정신과 치료를 받고 있다고 밝혔다. 이를 입증하는 방대한 양의 병원 진료 기록이 그 증거로 올라왔다. 또한 민규의 친구들이 성적인 농담을 했던 것은 사실이나, 민규는 거기에 동조하지 않고 슬며시 자리를 피하는 태도를 보여 왔다고 주장하기도 했다. 이에 대해 B가 입장을 밝혔다. C의 글에 적혀있던 내용은 전부 사실이 아니고, 자신의 기억과 C가 주장하는 상황이 너무 다르기 때문에 C가 다른 사람을 지칭하는거라 생각한다는 내용이다. 또한 소속사와 만나 얘기해보겠다는 말을 드디어 남겼다. 3월 12일, 플레디스 측은 폭로자와의 접촉 이후 공식 입장을 발표했다. 민규는 특정한 친구 한명을 일부러 괴롭게 만들거나 무안하게 만들려고 하지는 않았다 하였으나 과거 본인의 행동으로 인해 불편함을 느꼈거나 힘들었다면 그 점에 대해 사과드린다고 전했고 B는 이를 받아들였다고 한다. 또한 B는 이번 일로 인해 민규가 그룹을 탈퇴하거나 활동 중단으로 이어지게 되는 것은 원하지 않는다고 한다. 신원 확인이 가능한 이들과는 모두 논의가 마무리되어 오해를 풀었다고 한다. 또한 신원 확인 가능 여부가 명확하지 않은 나머지 사안도 현재 사실 관계를 파악하고 있는 중이며 추가적으로 파악되는 사항들은 향후 별도로 안내하겠다고 한다. [ 소속사 입장 전문 ] 안녕하세요. 플레디스 엔터테인먼트입니다. 온라인 상에 게시된 세븐틴 멤버 민규의 학창시절 관련 추가 확인된 내용을 안내드립니다. 당사는 아티스트와 같은 학원에 다녔던 일을 글로 쓰신 분과 여러 차례 이야기를 나누며 추가적인 사실 관계를 확인했습니다. 이러한 과정을 거쳐 이번 일에 대한 오해를 풀고 마무리하는 것으로 서로 확인하였습니다. 작성자께서는 중학교 재학 당시 아티스트와 상관 없이 개인적으로 여러 사건을 겪었고, 당시 중학교에서 있었던 일들을 알리기 위해 글을 쓰셨다고 합니다. 그리고 그 과정에서 학원에서 있었던 일을 남기게 되었다고 말씀 주셨습니다. 이에 대해 아티스트는 당시 학원 같은 반 남학생들과 함께 장난을 쳤던 적은 있지만, 특정한 친구 한명을 일부러 괴롭게 만들거나 무안하게 만들려고 하지는 않았다고 답했습니다. 그러나 과거 본인의 행동으로 인해 작성자께서 불편함을 느꼈거나 힘들었다면 그 점에 대해 사과드린다고 전했습니다. 작성자께서는 이를 받아들이셨고, 당사와 처음 이야기를 나누던 때부터 이번 일이 그룹의 탈퇴나 활동 중단으로 이어지는 것은 원하지 않는다고 말씀 주셨습니다. 당사는 작성자께 먼저 상기 입장문 내용을 확인하실 수 있도록 공유드렸고, 작성자께서도 내용 확인 후 동의해 주셨습니다. 따라서 더 이상 본 건으로 인한 크고 작은 논쟁으로 작성자께 혹시라도 피해가 가는 일이 없기를 바랍니다. 당사는 게시 내용 상 신원 확인이 가능한 분들과는 접촉 및 논의를 모두 마무리 하였습니다. 또한 신원 확인 가능 여부가 명확하지 않은 나머지 사안도 현재 사실 관계를 파악하는 중입니다. 추가적으로 파악되는 사항들은 향후 별도로 안내드리겠습니다. 위의 입장문이 올라오고, B는 지금까지 올렸던 글 3개를 삭제했다. 인스티즈 폭로글의 작성자와는 거의 한 달이 지난 시점에 겨우 만남이 성사되어, 소속사가 3월 21일 공식 입장을 밝혔다. 작성자를 제외한 해당 사건 관련자들 중 민규의 개입 여부를 기억하는 사람은 아무도 없으며 , 결국 작성자 개인의 오해에서 비롯된 해프닝으로 끝났다는 내용이다. 원글 포함 작성자 사과문이다. [ 소속사 입장 전문 ] 안녕하세요. 플레디스 엔터테인먼트입니다. 세븐틴 멤버 민규의 학창시절 관련 추가 확인된 내용을 안내드립니다. 당사는 중학교 동창생이 맞고 있을 때 아티스트가 이를 즐겁게 지켜보았다는 사안을 글로 쓰신 분과 연락이 닿았습니다. 작성자는 신원 노출이 우려되어 목격자처럼 글을 썼으나 해당 사안의 당사자였습니다. 당사는 작성자의 입장을 듣고, 해당 사안과 관련된 것으로 언급된 분들 및 당사에 제보된 학교 졸업생들의 증언을 참고해 사실 관계를 확인했습니다. 먼저 아티스트는 작성자가 주장한 사안이 기억에 없고, 특히 누군가가 맞고 있을 때 이를 즐겁게 지켜보고 부추기면서 욕을 한 적이 없다고 명확히 답했습니다. 작성자께서 가해자를 명시해주어 당사는 가해자의 증언과 당시 현장을 목격했을 것으로 추정되는 졸업생들의 증언도 함께 확인했습니다. 결론적으로, 작성자가 주장한 사안을 기억한다고 말씀주신 분은 아무도 없었습니다. 그래서 작성자가 직접 당시 현장에 함께 있었던 것으로 기억하는 친구에게 연락해 확인하였으나, 해당 친구도 그런 일이 기억에 없다고 답했다고 합니다. 이에 작성자는 해당 사안에 관련됐을 수 있는 모든 사람들의 기억이 없기 때문에 본 사안은 마무리하고 더 이상 거론하지 않겠다고 당사에 알려왔습니다. 당사는 누군가의 기억에만 의존하여 특정한 사건이 발생했다는 주장이 온라인에 공개되고, 기억이 확실하지 않자 마무리가 되는 흐름에 당혹스러움을 느끼고 있습니다. 이번 뿐만 아니라 이전에 확인된 사안들 모두 아티스트와 관련이 없는 것이 확인된 것은 다행이나, 이런 주장으로 인해 관련된 여러 사람들이 크고 작은 상처를 받게 되고, 이를 대응하기 위해 많은 시간과 노력을 들여야 하는 점을 어디까지 감내해야 할 지 고민이 되는 것은 사실입니다. 그럼에도 당사는 작성자와 논의하는 과정을 통해, 작성자가 아티스트와는 별개로 학창시절 교우관계에서 여러 상처를 입은 분으로 보여 이번 일에 대해서는 별도 조치 없이 사실 관계를 명확히 확인한 것으로 마무리하기로 결정했습니다. 당사는 현재까지 신원 확인이 가능한 분들과는 접촉 및 논의를 모두 마무리 하였습니다. 추가적으로 파악되는 사항이 있을 시 향후 별도로 안내드리겠습니다. 4월 6일 소속사의 최종 입장문이 올라왔다. #"
HYBE,세븐틴,민규,2021-03-09,2021년 3월 9일부터 유튜브를 통해 방영 예정이었던 자체 컨텐츠 < GOING SEVENTEEN 2021>이 무기한 연기되었다.
HYBE,세븐틴,민규,2017-04-11,"2017년 4월 11일 현재 남아있는 상태이며 뒤의 '포스트잇' 링크에서 볼 수 있다.(현재 삭제됨) 밥줄과 그만 좀 와요가 뭔 관계냐고 어리둥절해 하는 사람이 많은데, 이 팬은 세븐틴 멤버가 따로 본인에게 '그만 좀 와요' 라고 했던 적이 있었다며 그 음성을 푼 것이지, 절대 밥줄에 관한 음성을 푼다고 하진 않았다. 팬싸지 원본과 음성을 푼다고 여러 번 언급했기에 오해한 걸로 보인다. 추첨제로 돌아가는 팬싸인회는 앨범 한 장당 응모권 한 장을 받는다. 즉, 앨범을 많이 살수록 응모권이 많아져 당첨 확률이 올라간다는 뜻. 그렇기에 세븐틴 정도의 메이저 남자 아이돌은 팬싸에 당첨되려면 대략 70~100장 정도를 구매해야 안정권이다. 100% 운이기 때문에 저것보다 많이 사고 떨어지는 경우도 종종 있다. 그만큼 많은 앨범을 구매하고 팬싸에 온 팬에게 성의없는 답변을 해주거나 그만 오라고 말하는 것은 장난이라도 무례했다는 의견이 많다. 실제로 해당 팬은 기본 50장씩 질렀으며 매주 100만원 넘게 들였다고 밝혔다. 참고로 제작자가 밥줄 사건의 팬이랑 동일인물이다. 다만 공론화시킨 건 그 팬이 아닌 다른 팬. 아이돌 판에서 탈덕한 사람들이 왜 탈덕하게 되었는지 구구절절 얘기하면서 자기가 덕질했던 아이돌을 욕먹이는 부류가 있긴 하다. 다른 팬덤에서도 구남친/여친에 빗대어 구질구질하다고 욕하는 데, 애초에 여기는 케이스가 다르다. 상황 정리만 봐도 탈덕할 때 조용히 탈덕했으며, 시간이 지나 탈덕 경위를 밝히게 된 것도 결국 이후 팬들의 진상짓 때문이었다. 결국은 팬들의 난리쳐서 탈덕 경위를 밝히게 하고, 그 때문에 세븐틴 이미지가 손상된 것은 팬덤 잘못이 크다는 것이 중론. 정확히 말해, 콜드플레이나 체인스모커스 관계자를 지칭하는 주어가 없다. 중국의 남중국해 영토 주장이라고 알려지기도 했으나 남중국해 지지글은 아니다. 이는 홍콩 시위 도중 시위대에 의해 오성홍기가 훼손된 사건으로부터 시작된 챌린지로, 오성홍기 훼손 사건에 대한 부정적인 성격을 가지고 있다. 이 글이 하나의 중국 글이라고 알려지기도 했으나 하나의 중국 글은 아니다. 다만 중국 바이두 백과 의 태권도 문서 에는 태권도가 한반도 에서 유래되었다고 분명하게 명시되어 있다. 연애 프로그램에 출연한 적이 있으며 인스타그램 팔로워 10만 명이 넘는 인플루언서 이다. 아이러니하게도 열애설 이후 팔로워가 18만 명 가량 늘었다. 불가피한 이유가 없을 때에는 절대 빼지 않을 정도로 상징성이 강하다. 브로앤마블 제작발표회 1 , 2 하지만 탈퇴를 진정으로 원하지 않는다면서 조슈아의 탈퇴 요구를 시위 문구에 넣어 앞뒤가 맞지 않을뿐더러 시위의 목적이 불분명하고, 포르쉐가 열애설의 증거라는 주장 또한 루머에 불과하며, 상황과 크게 관련 없는 립싱크에 관해서도 언급하는 등 오로지 조슈아를 비방하는 행위만이 이어져 사실상 팬덤 안에서는 트럭시위 자체를 비판하는 분위기였다."
HYBE,세븐틴,민규,2022-08-26,"2022년 8월 26일에 진행한 것이 된다. 팬들은 조슈아의 개인 성향 차이인 것으로 눈을 감아주는 분위기기도 했고, 팀 전체 인원이 많다 보니 소통 부족이 부각되지 않았다. ASTRO 차은우 , 방탄소년단 정국 , NCT 재현 A는 민규가 중3때 연습생이 되었다고 주장 내용에서 볼 수 있듯이, 이 또한 루머로 판명났다. 오히려 민규는 장애 학생을 도와주며 잘 지냈다고 한다. B는 처음에 소속사와 컨택하지 않겠다고 명시했으나, 이 일을 기점으로 생각을 바꾼 듯 하다."
HYBE,세븐틴,도겸,2021-08-13,"2021년 8월 13일, 68억 5,000만 원 상당의 빌딩을 매입하였고 10월 13일 잔금까지 치렀다. 그런데 이 과정에서 본인 명의가 아니라 '로드케이'라는 법인을 내세워 해당 법인 명의로 부동산을 취득해 페이퍼 컴퍼니 의혹 논란 이 되었다. 해당 법인은 도겸 자신이 설립하고, 본인이 100% 지분을 가지고 있다."
HYBE,세븐틴,도겸,2022-01-24,"2022년 1월 24일, (도겸을 제외한) 아무도 없는 숙소에서 도겸의 V LIVE 방송 도중 외출했던 버논과 디노가 현관문을 열고 들어온 후, 디노가 '난리를 치고 싶은 날엔 꼭 예원 누나가 있더라고. 어? 없네..?' 라며 생방송임을 알지 못한 채 실수로 발언하고 도겸이 놀라며 논란이 되었다. 스태프라고 한다. 아래는 V LIVE 당시 상황을 그대로 옮긴 전문이다. [ 펼치기 · 접기 ] 디노: 뭔가 오늘 난리를 치고 싶은데 그런 날에는 꼭 예원 누나가 있더라고. 어 없네? (정적) 도겸: V LIVE 중이었어… 디노: 그렇구나. 도겸: 나와 나와 나와. 버논: 안녕하세묘~ 도겸: (웃음) 버논: (남은 치킨을 가리키며) 먹어도 돼? 도겸: 먹을래 이거? 버논: 먹어도 돼? 도겸: 응. 버논: 감사합니다. 도겸: 저는 이제 다 먹었으니 종료를 하겠습니다. 디노의 발언에 의하면 예원누나라는 인물이 세븐틴의 숙소에 자주 출입한다는 것인데, 스타일리스트나 스태프라면 바로 해명을 했을 테고 이렇게까지 당황할 일도 아니라 의심을 불러일으켰다. 방송사고 직후 일부 팬들은 디노가 경솔했던 거라는 의견과 도겸이 브이라이브 중이라고 말하지 않은 것이 문제라는 의견으로 나뉘었다. 디노의 발언보다는 도겸의 반응이 수상했던 게 제일 아쉬운 대처라는 팬들의 반응이 가장 컸다. 해당 방송 이후 V LIVE 다시보기는 삭제되었다."
HYBE,뉴진스,민지,2023-01-05,"2023년 1월 5일 진행한 침착맨 과 NewJeans 의 라이브에서 토크를 하던 중 민지 가 "" 칼국수 가 뭐지?""라는 혼잣말을 했다. 라이브 영상 (34분 45초) 라이브 당시에는 ""?"" 등의 물음표와 가벼운 이모티콘들이 채팅창을 차지했고, 대화는 바로 다음 주제로 넘어가서 크게 주목받지 않았다. 하지만 라이브 종료 후 다시보기와 클립 영상 등을 통해 퍼졌고, 일부 네티즌들은 해당 영상에 컨셉질이라는 부정적 내용의 댓글을 게시했다."
